{
  "type": "object",
  "$schema": "http://json-schema.org/schema",
  "properties": {
    "orderID": {
      "type": "string"
    },
    "placementDate": {
      "type": "string",
      "description": "The date the order was placed. Preferred format: yyyy-MM-dd HH:mm:ss."
    },
    "isFavorite": {
      "type": "boolean",
      "description": "Indicates if the user has favorited this order or not."
    },
    "name": {
      "type": "string",
      "description": "A name the user has assigned to this order."
    },
    "note": {
      "type": "string",
      "description": "A note the user has added to this order."
    },
    "pricing": {
      "$ref": "pricing.json",
      "description": "An encapsulation of the pricing details associated with this order."
    }
  },
  "required": [
    "orderID"
  ]
}