[
  {
    "orderID": "1",
    "placementDate": "2014-10-11 00:00:00",
    "note": "Use the side door please",
    "isFavorite": false,
    "name": "Thursday order",
    "pricing": {
      "pricingID": "1",
      "cost": 258.96,
      "taxAmount": 21.3,
      "discountAmount": 32.5,
      "discounts": [
        {
          "discountID": "1",
          "discountAmount": 32.5
        }
      ],
      "orderItems": [
        {
          "orderItemID": "KTKC61",
          "cost": 28.12,
          "itemCount": 1,
          "item": {
            "brandID": "12642",
            "brandName": "BECKS SP LIGHT",
            "itemID": "KTKC6",
            "name": "BCKLT 4/6/12 LN USP3",
            "price": {
              "priceID": "2790",
              "unitPrice": 26.92
            }
          }
        }
      ]
    }
  }
]